,post_Title,onion
292,"Wisconsin high school cheerleaders received awards for biggest breasts, butt at banquet",0
293,"Homeless denied social housing for being too poor, study says",0
294,Anti-porn filters stop Dominic Cummings trending on Twitter,0
295,Man in Hong Kong reportedly beaten up outside cinema for leaking Avengers: Endgame spoilers,0
296,BBC made Russell Howard rewrite a joke - in case it offended Isis,0
297,"Decriminalization of Domestic Violence Was a 'Mistake,' Russian Official Admits",0
298,Some Oregonians in Panic Mode After Law Allowing Motorists to Pump Their Own Gas Takes Effect,0
299,"Police officer fired for not shooting black suspect wins $175,000",0
300,Death Wish Coffee recalls cold brew cans due to potentially deadly toxin concerns,0
301,"Pastor admits to ""sexual incident"" with teen 20 years ago, gets standing ovation",0
302,"Man Who Had Caricature of Himself Drawn Steals Artist’s Money, Leaves Portrait Behind: Riverside PD",0
303,Thailand threatens to sue Facebook after videos emerge of king in crop top wandering in German shopping centre,0
304,Utah woman killed on cruise ship during murder mystery dinner,0
305,Superintendent Says Students Are Armed with Rocks In Case of a School Shooting,0
306,Big Cheese festival apologises for running out of cheese,0
307,Fatal police shootings could become a crime under proposed California law,0
308,This Utah woman was charged for being topless in her own home.,0
309,"Wisconsin sends 17,000 pounds of cheese to Houston",0
310,"Muffin Break boss slams Millennials, says young people won’t do unpaid work",0
311,A startup is pitching a mind-uploading service that is “100 percent fatal”,0
312,A parody website with embarrassing photos of Joe Biden is outranking his official campaign page on Google,0
313,Military veteran frustrated he has to annually fill out form to say his legs are still missing,0
314,This Republican politician allegedly told a woman 'I no longer have to be PC' before grabbing her crotch,0
315,Man chokes cashier for putting chips and canned goods in same grocery bag,0
316,Florida cop claims Burger King put dirt on his food — investigation reveals it was seasoning,0
317,Florida troopers find narcotics in bag labeled ‘Bag Full of Drugs’,0
318,Outcry after MSNBC host compares Sanders’ Nevada win to Nazi invasion,0
319,Army warns soldiers to be ready for potential violence by incels at 'Joker' screenings: reports,0
320,"Obese ISIS preacher who endorsed rape, ethnic cleansing carried to prison in truck",0
321,Bill Cosby says he is still 'America's Dad' in Father Day's tweet,0
322,El Paso woman living in Montana detained by Border Patrol for speaking Spanish,0
323,The first person to cross Antarctica alone and unaided says he pooped his pants less than halfway through - and had to continue using the same underwear for 38 days,0
324,We Do Not Have a Child Slave Colony on Mars: NASA,0
325,WeWork has reportedly postponed thousands of layoffs because it's too broke to pay workers severance,0
326,Mark Zuckerberg on billionaires: 'No one deserves to have that much money',0
327,"China says Xinjiang has 'boarding schools', not 'concentration camps'",0
328,Ukraine bans Steven Seagal as threat to national security,0
329,"People have paid a company more than $80,000 to dig a hole for absolutely no reason",0
330,The only official fired over the virus? A captain who tried to protect his crew.,0
331,University Professor: Men Don't Recycle Because They Don't Want People Thinking They're Gay,0
332,Ohio State Has Filed A Trademark Application For The Word “The”,0
333,Parents allow 11-year-old to drive car because they were sick of him playing GTA all day,0
334,A single factory is now working 24/7 to keep Kraft Dinner on grocery shelves,0
335,"Dr. Dre Boasts About Daughter Getting Into USC ‘All on Her Own,’ Then Remembers $70 Million Donation",0
336,No one shot in Chicago in 22-hour span,0
337,A woman was told to stop speaking 'foreign muck' but was actually speaking Welsh... in Wales,0
338,"50 Cent says he bought 200 front-row tickets to a Ja Rule concert, just so they'd be empty",0
339,YouTube gun ban drives bloggers to PornHub,0
340,People are walking into glass at the new Apple headquarters,0
341,Even the Insane Clown Posse Isn't Insane Enough to Gather This Year,0
342,North Carolina didn't like science on sea levels … so passed a law against it,0
343,Venezuela's currency value depends largely on one guy at an Alabama Home Depot,0
344,YouTube mistakenly flags Notre Dame Cathedral fire videos as 9/11 conspiracy,0
345,Betsy DeVos labels Black Colleges 'pioneers of choice' despite being set up for African-Americans with no options,0
346,17-year-old discovers planet 6.9 times larger than Earth on third day of internship with NASA,0
347,US police sergeant told to 'tone down the gayness' wins $20m in damages,0
348,Spaniard raised by wolves disappointed with human life,0
349,Delaware on verge of being first U.S. state to ban child marriage,0
350,Man With His Own Name Tattooed on his Neck Arrested for Giving Fake Name,0
351,Fake news: The Onion's fake headline about Cleveland's sewer system is actually true,0
352,Canadian politician says a family can eat on $75 a week,0
353,Divorces rise by 30% in Saudi Arabia after quarantine uncovers polygamous husbands,0
354,Police say 'Free Candy' van not a threat to public,0
355,The American Dream is much easier to achieve in Canada,0
356,Massachusetts mayor first in line as recreational marijuana sales begin,0
357,FCC chair Pai receives NRA gun award for courage,0
358,Woman almost dies after unborn baby kicks a hole in her womb,0
359,Apple's $300 book contains 450 photos of Apple products,0
360,Wells Fargo: Shareholders can't sue us because they should have known we were lying,0
361,Universities launch drive to recruit more white males as low numbers give them 'minority group' status,0
362,Japanese worker punished for starting lunch three minutes early,0
363,Fox News Mistakenly Uses Photo of Patti LaBelle in Aretha Franklin Tribute,0
364,Russian workers are undergoing training to learn how to smile ahead of the World Cup,0
365,Man arrested for choking driver who wouldn't stop singing Christmas carols,0
366,Papa John's founder eats more than 40 pizzas in 30 days. The verdict: It tastes different,0
367,Michael Bay to Produce Live-Action ‘Dora the Explorer’ Movie,0
368,Man fed up with nagging wife hides in forest for 10 years,0
369,Georgia defends voting system despite 243-percent turnout in one precinct,0
370,Charlottesville photo: Man shouting angrily at white supremacist rally insists he is not 'an angry racist',0
371,"MSP officer runs stops sign, hit by car, arrests other driver",0
372,"Gunman kidnaps family, forces them to shop at Target",0
373,"Syria Says U.S. Should Give Israel 'South Carolina' Instead Of Golan Heights, 'It's The Land Of Senator Lindsey Graham'",0
374,Unlicensed “health coach” claims health advice is free speech—court disagrees,0
375,Montreal mother told daughter doesn't count as 2nd passenger in carpool lane,0
376,Police planned to sell crime victim's car at auction instead of returning it,0
377,House passes amendment ordering Pentagon to review whether U.S. experimented with weaponizing ticks,0
378,Patients whose emergency surgeries are delayed have higher risk of dying: study,0
379,One in eight young people in the UK have never seen a real cow,0
380,Wisconsin man injured after upskirting shoe camera explodes,0
381,"Pope Francis admits: 'When I pray, sometimes I fall asleep'",0
382,Brazil's President Jair Bolsonaro joined a rally to end quarantine measures,0
383,Man mistakenly runs full Fargo marathon instead of half,0
384,"Jenny McCarthy doesn't know what her Google Home sounds like, assumes it's a ghost",0
385,"Robotic dildo barred from top tech showcase, prompting sexism claims",0
386,"Using emojis to teach Shakespeare will not help disadvantaged students, says head",0
387,"In Serbia, School Shooter with AK47 Got Beaten up by PE Teacher.",0
388,Texas man brings steer to Petco to test ‘all leashed pets are welcome’ policy,0
389,George RR Martin: ‘When I began A Game of Thrones I thought it might be a short story’,0
390,"Removing a GPS tracking device from your car isn’t theft, court rules",0
391,Google tracked his bike ride past a burglarized home. That made him a suspect.,0
392,"Dr. Oz apologizes for saying reopening schools is an ""appetizing opportunity"" because it would only kill 2-3% more people",0
393,"Beginning next school year, Wake County substitute teachers must have high school diploma",0
394,Man loudly cheering on-screen murders in 'Joker' NY screening sends many to exit,0
395,Protesters throw Pepsi cans at police during May Day demonstrations,0
396,Florida candidate says alien abduction doesn’t define her,0
397,"Putin: 'I am not a woman, so I don’t have bad days'",0
398,Rick Perry suggests fossil fuels help prevent sexual assault,0
399,"Mgm Resorts Sues More Than 1,000 Las Vegas Shooting Victims To Avoid Liability In Massacre",0
400,Pentagon says it still hasn't sent ventilators because it hasn't been told where to send them,0
401,"Without Obama, once-booming gun industry poised to shrink",0
402,"Sheboygan serial toilet clogger sentenced to 150 days in jail, probation",0
403,Putin on US administration: 'It’s difficult to talk with people who confuse Austria and Australia',0
404,Sean Spicer stole a mini fridge from Junior White House staffers,0
405,"Child molester’s wife sues Mormon church for $9.5 million, says husband is in prison because clergy reported his confession",0
406,Anti-Defamation League Declares Pepe the Frog a Hate Symbol,0
407,All of Mugshots.com’s alleged co-owners arrested on extortion charges,0
408,Game of Thrones viewers in China 'beg' for sex and violence to not be censored in final season,0
409,Amazon Reportedly Killed an AI Recruitment System Because It Couldn't Stop the Tool from Discriminating Against Women,0
410,Seminar on training police to kill without hesitation coming to Kansas City this December,0
411,"Prince Andrew: I didn’t have sex with teenager, I was home after Pizza Express in Woking",0
412,Applebee's offering $1 margaritas in October to remind people it's also a 'bar',0
413,Nintendo confirms Mario was originally punching Yoshi in the head,0
414,InfoWars' Alex Jones Says He's Been Defamed by Defamation Suits,0
415,Twitter CEO says Mark Zuckerberg once killed a goat with a stun gun and served it to him for dinner,0
416,"Accused of underpaying women, Google says it's too expensive to get wage data",0
417,Nestle says slavery reporting requirements could cost customers,0
418,‘Did I miss anything?’: A man emerges from a 75-day silent retreat in Vermont,0
419,Rio 2016: Officials forced to cut their way into Olympic stadium after losing keys to gate,0
420,Robert Pattinson refused to perform sex act with dog for new film,0
421,"Philippines’ Duterte says he stabbed someone to death as a teen, then proposes hosting human rights summit",0
422,Israel responds with 'Mean Girls' GIF after Iran's Ayatollah Khamenei's nuclear threats,0
423,Missouri lawmaker introduces bill that would require AR-15 ownership,0
424,Pizza man celebrated as 'hero' after making it through G20 crowds,0
425,NYC Sex Shop Sued Over 6-Ft Sewage Wall From Condom Buildup,0
426,Study finds Americans who join ISIS are disappointed by the experience,0
427,Bishop says homosexuality passed on to the unborn when pregnant women enjoy anal sex,0
428,Local teenager robbed at gunpoint by teen he planned to rob,0
429,"After finding his doppelganger, Kansas City man is freed from prison",0
430,Man declares he is now attracted to men after taking painkillers,0
431,"R Kelly claims he can't read, says he couldn't properly defend himself in sex abuse case",0
432,Lawyers say ‘tax haven’ is a dirty word in Panama Papers case,0
433,"Joe Biden calls game developers ""little creeps"" who make titles that ""teach you how to kill""",0
434,BP claims an oil spill off Australia's coast would be a 'welcome boost' to local economies,0
435,Poll: 80% of voters think the U.S. is spiraling out of control,0
436,"Prisoners built two PCs from parts, hid them in ceiling, connected to the State's network and did cybershenanigans",0
437,Convicted murderer says life sentence was served when he died and was revived after septic poisoning,0
438,Russian bank: we assigned $12 billion 'loan' to poor African state by mistake,0
439,"Dennis Rodman offers to help Trump, US 'straighten things out' with North Korea",0
440,Christmas service accidentally prints words to Tupac's ‘Hail Mary’ instead of carol,0
441,World Clown Association Complains The Movie ‘IT’ Is Hurting Real Clowns,0
442,"Knife robber tries to rob Glasgow shop but is beaten with mop, tries to rob nearby shop and is beaten with mop again",0
443,Condom Company Releases “Baby Blocker” to Wipe Baby Pictures From Social Media Feeds,0
444,Obama dreams of opening a T-shirt shack in Hawaii after he leaves the presidency,0
445,Rapper B.o.B. Has Started a GoFundMe Campaign to Prove That the Earth Is Flat,0
446,Florida candidate poses with fake diploma after questions about her credentials,0
447,Pilot 'congratulates' passengers for drinking all alcohol on plane,0
448,Texas House passes bill legalizing lemonade stands run by children,0
449,Mike Pence warns U.S. heading for Canada-style health care if Graham-Cassidy bill fails,0
450,Congressman tells angry constituents the idea that they pay his salary is ‘bullcrap’,0
451,Millions of People Face Stimulus Check Delays for a Strange Reason: They Are Poor,0
452,American airline wins right to weigh passengers to prevent crash landings,0
453,4 underage men accused of drinking while operating horse and buggy,0
454,Woman left homeless after thieves steal her house,0
455,A Saudi singer was jailed after dabbing during a concert,0
456,Britain’s richest men worth £22 billion use taxpayers’ cash to furlough staff,0
457,Youporn bans Starbucks after Starbucks banned Porn,0
458,"Paige Patterson, Who Was Fired For How He Handled Student Rape Allegations, Will Now Teach a Christian Ethics Course",0
459,NC mom invents a spray she says will attract any Bigfoot within a mile and a half,0
460,"New type of northern lights discovered, named Steve",0
461,American Airlines flight departs Manchester 22 minutes early without passenger - and blames passenger,0
462,Worker who raised alarm before deadly New Orleans hotel collapse to be deported,0
463,Black delivery driver blocked into Oklahoma neighborhood by HOA president,0
464,"Astronauts find hole in the International Space Station, plug it with thumb",0
465,US Kindergartens Now Teaching Nursery Rhymes To Prep Kids For School Shooters,0
466,Top ICE Lawyer Sentenced to Four Years in Prison For Stealing Immigrants’ Identities,0
467,'Penis Man' Graffiti Artist Arrested by '25 Heavily Armed SWAT Officers',0
468,"Enraged naked postal worker goes on killing spree, police say",0
469,"Pipeline spills 176,000 gallons of crude into creek about 150 miles from Dakota Access protest camp",0
470,"A ""caravan"" of Americans is crossing the Canadian border to get affordable medical care",0
471,"In Amsterdam, Even The Tourists Say There Are Too Many Tourists",0
472,Miami orders scooters removed from streets before hurricane Dorian turns them into flying projectiles,0
473,Japanese mayor says men should grocery shop during pandemic as women 'take a longer time',0
474,A school called police after a kindergartner with Down syndrome pointed a finger gun at her teacher.,0
475,Man Lost in Snow for Five Days Survived on Taco Bell Sauce Packets,0
476,President Xi congratulates Kim Jong Un on reelection,0
477,"The Shape Of Water would have been less popular if she'd fucked a dolphin, reports guy who once fucked a dolphin",0
478,How Many People Have to Die Before We’re Done With Gender Reveals?,0
479,Man grieved at wrong grave for 30 years due to misplaced headstone,0
480,Mexicans demand crackdown on Americans crossing the border,0
481,"Woman in China sends 1,000 kg onions to ex-boyfriend to make him cry",0
482,DeVos backlash Sees Parents Threatening to Homeschool Kids,0
483,Vatican Releases Pokemon GO Clone For Catholics,0
484,"""One hour of Peppa Pig a day gave my child a British accent.""",0
485,Delhi air quality improves to ‘very poor’,0
486,"Alcohol-free sanitizer given to prisoners to prevent them from making ""moonshine""",0
487,Some anti-vaxxers are changing their minds because of the coronavirus pandemic,0
488,2 accidentally shot at church during church shooting discussion,0
489,"Cow runs away from Indiana police, blocks traffic and goes to Chick-Fil-A",0
490,Iranian factory makes U.S. and Israeli flags to burn,0
491,Julia Roberts 'was first choice' to play black abolitionist Harriet Tubman,0
492,Ohio abortion ban proposal calls for reimplanting ectopic pregnancies,0
493,"Child spies used only when very necessary, says Downing Street",0
494,Pet deer named after Bambi character shot dead in front of US family in their driveway,0
495,Amazon removes circumcision training kits from sale,0
496,Phoenix flights cancelled because it's too hot for planes,0
497,"Police handcuff people trying to protect store from apparent looters, while suspects run away",0
498,"'Sorry,' says man, 19, who opened fire at Florida high school",0
499,Russia warns US against 'meddling' in presidential election,0
500,Ann Ashford's virtual town hall delayed by person posting porn during video chat,0
501,"Nebraska flag flew upside down at Capitol for 10 days and 'nobody noticed,' says senator who wants design change",0
502,Shredded T-shirts used as toilet paper back up California city sewer,0
503,"Kim Jong Un Reportedly Dead, Bookmakers Refrain From Offering Odds",0
504,"As measles outbreak spreads, one anti- vaxxer asks how to keep her child safe",0
505,Georgia lawmaker: Can people with HIV be 'legally' quarantined?,0
506,"Construction crew hits underground fiber line, causes outage of 'call before you dig' hotline",0
507,Syria’s Assad Says Jeffrey Epstein Did Not Kill Himself,0
508,Obsessed fan finds Japanese idol's home by zooming in on her eyes,0
509,"Woman thought she had kidney stones, gave birth to triplets",0
510,"‘We don’t want to con anyone’: Inventor charging $50,000 for rain denies ‘preying’ on farmers",0
511,Charlie Daniels warns Taco Bell: 'The illuminati is not a frivolous subject',0
512,Japan suicides decline as Covid-19 lockdown causes shift in stress factors,0
513,"After 6-Year Battle, Florida Couple Wins The Right To Plant Veggies In Front Yard",0
514,"To fight high drug prices, Utah will pay for public employees to go fill prescriptions in Mexico",0
515,"German zoo's 'escaped' animals didn't actually escape, just hiding",0
516,Facebook apologizes after mistaking Trump social media director for a bot,0
517,Court Recommends Electronic Monitoring For Woman Accused Of Escaping Electronic Monitoring,0
518,Slovakian woman arrested for playing opera non-stop for 16 years,0
519,Hong Kong billionaire tycoons call for end to protests as unrest affects their profits,0
520,Satanic Temple cites religious beliefs as immunity from Supreme Court abortion ruling on fetal remains,0
521,Moscow Says It Has Nothing to Do With Hundreds of Tanks in Eastern Ukraine,0
522,Jessica Simpson sued for posting paparazzi photo of herself on Instagram,0
523,"Grizzly bears go vegetarian due to climate change, choosing berries over salmon",0
524,Denver police have forgotten about people in their custody overnight three times this year,0
525,"Lady Gaga's super bowl halftime performance was actually a Satanic ritual, say the Alt-Right",0
526,US rapper Lil Wayne 'never going back to Riyadh' after Saudi concert,0
527,Forest Service Recommends Hugging Trees While You Can’t Hug Others,0
528,"Saudi Arabia has more women's rights than the West, says Saudi princess",0
529,"And You Thought Your Day Was Bad: Suspects Pocket Dial 911, Discuss Plans To Rob Restaurant...Where Police Chief Was Eating",0
530,"Omaha dad finds pot brownies, eats 4 of them, says mean things to cat",0
531,Bar owner says health-conscious customers who only order tap water are ruining her business,0
532,"Utah lawmaker doesn't recommend 'shooting up marijuana,' but says 'no big deal' after first-use",0
533,Award-winning lamb under investigation for performance-enhancing drugs,0
534,The Queen reported to West Yorkshire Police for 'not wearing seat belt',0
535,Half of 8th grade class from New Jersey refuses to pose with Speaker Ryan,0
536,German city offers $1.1M to whoever proves it doesn’t exist,0
537,A man found 54 human hands in the snow. Russia says they’re probably just trash,0
538,"Applebee's is betting on stress eaters, and it's paying off",0
539,"New York City EMT suffers stroke driving ambulance, then colleague who came to help has aneurysm",0
540,Man who ordered gluten-free meal on flight is given a single banana – and cutlery to eat it with,0
541,Suicidal man doused in gasoline catches fire after police use Taser on him,0
542,"In 2019, more Americans went to the library than to the movies. Yes, really.",0
543,Black US politician reported to police while canvassing for votes,0
544,"Pittsburgh Doctor Claims Antonio Brown Repeatedly Farted In His Face, Owes Him $11,500",0
545,BP worker wins after Hitler meme case goes all the way to Federal Court,0
546,‘Live pee or die’: N.H. governor steps in to let woman keep her ‘PB4WEGO’ license plates,0
547,App concept records sexual consent in legally binding agreement,0
548,Women-only network appoints male chairman,0
549,Workmen's cafe overwhelmed with customers after it is accidentally awarded a Michelin star,0
550,Donald Trump officially names Obamacare replacement 'World's Greatest Healthcare Plan of 2017’,0
551,Facial recognition can't tell black and brown people apart - but the police are using it anyway,0
552,Police nab 'Nigerian prince.' He's a 67-year-old guy in Slidell. Who knew?,0
553,Nanny cam at Phoenix home catches federal agent smelling girl's underwear,0
554,"Woman Cop Proposes Wanted Criminal, Arrests Him In Temple During Marriage",0
555,Indonesian minister calls on the rich to marry the poor as a way to cut country's poverty rate,0
556,German zombie hunters stopped at Swedish border with car full of weapons,0
557,B.C. couple loses child custody after stuffed lion purportedly transmitting the word of God acted as their lawyer,0
558,Stephen Miller's third-grade teacher suspended after saying he ate glue as child,0
559,Town with brown water has no record of cleaning its water tower,0
560,Japanese firm to use drone to force overtime staff to go home,0
561,Joel Osteen: Televangelist whose church closed during Hurricane Harvey tells victims not to have 'Poor Me' Attitude,0
562,Iran charges families for bullets used to kill protesters,0
563,Bill Cosby Says Being Declared A Sexually Violent Predator Will Damage His Reputation,0
564,Fortnite Addiction Is Becoming a Problem for Major League Baseball,0
565,"Rick Perry is being considered for energy secretary, a position he wanted to eliminate",0
566,Someone is putting tiny cowboy hats on pigeons in Las Vegas as animal rescue works to remove them,0
567,Black actor in play about racism complains after police mistake him for drug dealer outside theatre,0
568,"Teenager on the run responds to police on FB, asks them to use better picture of her",0
569,Australia sends out same-sex marriage survey with barcode 'bumsex',0
570,Police: Thieves using blowtorch to steal from Everett ATM accidentally set cash on fire,0
571,Man who accidentally stole car 21 years ago searching for vehicle's owner,0
572,Donald Trump's team 'holding meetings in the dark as they can't find right light switch in White House',0
573,Clearwater mayor calls for assault weapons ban: ‘My prayers aren’t working’,0
574,"China Launches World’s First All-Electric Cargo Ship, Will Use It To Haul Coal",0
575,Man's Jack Daniel's flag mistaken for ISIS flag by 'worried' neighbors,0
576,"Cheddar-gate: French chef sues Michelin Guide, claiming he lost a star for using cheddar",0
577,British officials create 41-mile detour for 65-foot-long road closure,0
578,"Pregnant women's bodies are 'hosts', says US lawmaker",0
579,Michigan cops may soon be barred from having sex with prostitutes while undercover,0
580,White noise video on YouTube hit by five copyright claims,0
581,Man was arrested for breaking social distancing rules - by paddle boarding alone with nobody around,0
582,"Fearing Their Dogs Will Develop Autism, Some Owners Are Declining Vaccinations",0
583,Trump misquotes himself while claiming Wall Street Journal misquoted him about Kim Jong Un,0
584,Greensboro Man Creates Dating App Where He's The Only Guy Allowed,0
585,Star Wars villain Kylo Ren becomes fastest-rising baby name in the US,0
586,67-year-old man dies from heart attack after catching prized Pokemon 'Lapras' at MBS,0
587,Police unsure if car dangling from Toronto bridge is part of movie shoot,0
588,Nordstrom offering pre-dirtied jeans for $425,0
589,Alberta police dog accidentally fires handgun found after parking lot fight,0
590,Thousands sign up to clean sewage because they didn't read the small print,0
591,"Wife in UAE seeks divorce because husband loves her a lot, doesn't argue with her",0
592,Hundreds rally to preserve right not to vaccinate children amid measles outbreak,0
593,"Some Rivers Are So Drug-Polluted, Their Eels Get High on Cocaine",0
594,"With ingestible pill, you can track fart development in real time on your phone",0
595,Unpaid $8.41 property tax bill cost Michigan man his house,0
596,Man arrested for speeding in DeLorean at 88mph,0
597,"Police Use Taser on Woman, 87, Who Family Says Was Cutting Dandelions",0
598,"Man Uses $1m Win To Finally Visit Doctor, Gets Terminal Cancer Diagnosis, Dies Weeks Later",0
