,post_Title,onion
913,French PM Suggests Naked Breasts Represent France Better Than a Headscarf,0
914,"Wife crashes her own funeral, horrifying her husband, who had paid to have her killed",0
915,US government memo on the danger of leaking to media has been leaked,0
916,"Canadian woman writes own obituary, says she has ‘smoking hot body she always wanted’ after being cremated",0
917,Toddler signals ‘help’ in sign language during photo with Santa,0
918,Einstein note about happiness of a modest life sells for $1.5m,0
919,Uttarakhand court sets 5-decibel limit for loudspeakers; your breathing is louder,0
920,Smash-And-Grab Thieves Hit Pot Shop But Only Got Away With Oregano,0
921,Amazon pulls hair dryer after woman discovers it shoots fire,0
922,105-Year-Old Woman Requests Hunky Firefighters for Birthday Party,0
923,Man arrested after doing burnouts in front of news crews during hurricane,0
924,Those frozen NC alligators have thawed out and they are really grouchy now,0
925,Volunteers needed to smoke pot for science,0
926,Ashford postman Robert Lockyer sacked 'for being a minute late with delivery',0
927,"Citing grizzlies, education nominee says states should determine school gun policies",0
928,"After hours-long standoff at West Jordan home, police determine individual not home",0
929,Republican who claims Holocaust was orchestrated by Gay Nazis wins enough support for Massachusetts Governor primary.,0
930,Passenger causes plane to divert after he's charged $12 for a blanket,0
931,"He shot at five women on the road — because he thinks only men should drive, Texas cops say",0
932,Republican Wisconsin assembly speaker wears protective gear while telling voters they are 'incredibly safe to go out',0
933,Mother renames son after tattooist makes spelling error,0
934,"Texas Man Wanted After Allegedly Filing, Completing Divorce From Wife Without Her Knowing",0
935,"Dog accidentally runs US half-marathon, finishes in an impressive seventh place",0
936,Mayor offers reward to first couple to have a boy in village where only girls are born,0
937,Restaurant that killed customer with nut allergy sends apology email advertising new dessert range,0
938,Jail for man who kicked taxi driver out of car saying 'my turn to drive',0
939,Texas prisons ban books by Langston Hughes and Bob Dole - but 'Mein Kampf' is OK,0
940,Someone is using Gabe Newell’s face to sell underwear in China,0
941,"Woman wearing ""Stop Domestic Violence"" T-shirt arrested for domestic violence",0
942,All-you-can-eat restaurant closes after customers eat too much,0
943,"Lil Wayne refuses to go through security check, skips own concert",0
944,That fighter who died in the cage last weekend wants you to know he’s feeling much better,0
945,Trucker found love by texting number scrawled on toilet wall offering a 'good sh*g',0
946,"Facebook fires human editors, algorithm immediately posts fake news",0
947,"US citizens in Lebanon decline repatriation offer, saying it's 'safer' in Beirut",0
948,'Hi-tech robot' at Russia forum turns out to be man in suit,0
949,Sex offender serves as grand marshal of Mississippi town’s Christmas parade,0
950,Texas plans to designate official state gun along with other weapons,0
951,"‘Bi-sexual’ beetles don’t swing both ways...they’re just inept at mating, study shows",0
952,"For men, the importance of safe sex depends on how hot their partner is",0
953,"City of Denver doesn't know who's running ""city of Denver"" Instagram account",0
954,New 'indestructible' £1 coins are 'melting' and some centre pieces have dropped out,0
955,Avocado shortage fuels crime wave in New Zealand,0
956,"Marijuana burglars hit Florida dispensary at 4:20 a.m., police say",0
957,'Clown Lives Matter' peace walk canceled after multiple threats,0
958,Meeting on overcrowded schools sparsely attended,0
959,Increasingly paranoid ISIS leader reportedly refuses to sleep without suicide vest,0
960,Pet owner saved his drowning tortoise's life after giving it mouth-to-mouth for an hour,0
961,Former Springfield sprinkler company ruled total loss after fire,0
962,Dunkin’s latest release is quite simply a bag of bacon,0
963,Pittsburgh shooting suspect who wanted to ‘kill all Jews’ was treated by Jewish doctors,0
964,"This Saints fan was 'determined' not to watch the Super Bowl, his obit says. He died just hours before the game",0
965,Treating patients in supply closets final straw for ER doctors in Kentville,0
