,post_Title,onion
599,"Balenciaga's $2,145 bag is just like Ikea's 99 cent tote",0
600,Trump’s press secretary has been fighting with Dippin’ Dots for 5 years,0
601,"FEC declares Kid Rock couldn't have run for senate as ""Kid Rock,"" thus clearing him of federal complaints",0
602,"Bitcoin mining could cancel out climate change efforts, scientists say",0
603,Radio ad in Arkansas suggests ‘lynching’ if Democrats win,0
604,"Ted Cruz tweets Zodiac Killer confession, extending the internet's favorite meme",0
605,US Department of Education misspells name of civil rights activist W.E.B Du Bois — then misspells apology tweet,0
606,Florida Didn't Conduct Gun Background Checks for a Year Because an Employee Couldn't Log In,0
607,‘We will declare war’: Philippines’ Duterte gives Canada 1 week to take back garbage,0
608,Florida medical examiners were releasing coronavirus death data. The state made them stop.,0
609,"Shopworker stole £1,500 worth of scratchcards — and didn't win ANYTHING",0
610,Lindsey Graham prank called by Russians pretending to be Turkish defense minister,0
611,"Uber can't keep down accusations of ""vomit fraud"" against its drivers",0
612,Police: Flushing drugs could create Alabama ‘meth-gators’,0
613,'You will never be forgotten' headstone left behind at airport,0
614,Michigan state senator apologizes for wearing face mask that looks like Confederate flag,0
615,"Crematorium goes up in flames, bodies survive",0
616,Man Survives Jumping Into Zoo's Elephant Enclosure as Animals Show Mercy and Escort Him Out,0
617,Youth leader facing sex charges claims teen was 'keen as a jellybean',0
618,Cabinet member praises absence of protest in a country where protests are illegal,0
619,Adidas Apologizes After Sending ‘You Survived’ Email to Boston Marathon Finishers,0
620,"Meanwhile, on Reddit, dudes can’t stop talking about fucking coconuts",0
621,Laid-off state employees being called back to staff unemployment compensation centers,0
622,Africa Trade Meeting Has No Africans After US Visa Denials,0
623,Winnipeg's 1st toking and driving ticket issued 1 hour into legalization,0
624,Rio diving pool—still green—now closed and smells like farts,0
625,Facebook apologizes after labeling part of Declaration of Independence 'hate speech',0
626,Japanese security firm finds success with guards dressed as ninja,0
627,Woman on trial for laughing during Jeff Sessions' confirmation hearing,0
628,More states allow sunscreen at schools without doctor’s OK,0
629,John Kelly: 'The lack of an ability to compromise led to the Civil War',0
630,Republican Congressman Says God Will 'Take Care Of' Climate Change,0
631,"Google CEO responds to Steve King's iPhone concerns: 'Congressman, iPhone is made by a different company'",0
632,Police: Fake cop busted pulling over real detectives on Long Island,0
633,Footballer accidentally thanks his wife and girlfriend in incredible man of the match speech,0
634,Lawmakers sick after drinking raw milk to celebrate legalizing raw milk,0
635,Coronavirus Conference Gets Canceled Because of Coronavirus,0
636,"Seattle Times apologizes for not knowing where Alabama, Mississippi are located",0
637,15-year-old activist accuses world leaders at UN climate conference of 'behaving like children',0
638,Boy sent home from anti-bullying day at Auckland school for not wearing enough pink,0
639,I acted as a man to get work - until I was accused of rape,0
640,Uk surgeon finds 27 missing contact lenses in woman’s eye,0
641,Netflix develops marijuana strains based on its original shows,0
642,11yo tries and fails to bribe Prime Minister Jacinda Ardern into funding dragon research,0
643,Joaquin Phoenix will wear the same tuxedo for every awards show this year to 'reduce waste',0
644,Venezuela's currency now worth so little shopkeepers weigh vast piles of notes instead of counting them,0
645,Theatre-goer attacks ‘Roman soldier’ in a bid to rescue ‘Jesus’ from being crucified,0
646,"New Zealand thrash-metal band will miss Salt Lake City show, because they’re too young to enter a bar",0
647,Man who stood in line to rob bank wearing mask and gloves wasn't queried because staff thought he may have skin condition,0
648,Estonian Police Unmasked 13 Year Old Head of International neo-Nazi Group,0
649,Man Wants Town To Pay For Damage On His Lowered Car After Driving Over Speed Bumps,0
650,Wal-Mart Asks Employees to Deliver Packages on Their Way Home,0
651,"Black teenage woman, mistaken for machete-wielding black man, alleges police brutality",0
652,Lion unleashed on Pakistani man for demanding wages,0
653,Australian man patents the Hamdog - a hotdog and burger combo,0
654,Mother files federal lawsuit after son doesn’t make varsity team,0
655,Sheriff: Man With Cocaine in Nostrils Tells Deputies It's Not His,0
656,"South Florida drivers would trade sex for less traffic, poll shows",0
657,Chinese farmer unleashes 300 million hungry cockroaches to eat food waste,0
658,Vancouver condo developers offer free wine or year’s supply of avocado toast to woo buyers in slowing market,0
659,Video: SNES Classic Runs PSone Games Better Than The PlayStation Classic,0
660,"In a Leaked Memo, Apple Warns Employees to Stop Leaking Information",0
661,Hackers are getting hacked via trojanized hacking tools,0
662,People stroll by as reporter ‘braces’ against wind. Weather Channel blames ‘wet grass’,0
663,'Lesbianism' listed as condition on North Carolina woman's medical chart,0
664,Martial arts academy posts how-to video for defending against Trump handshake,0
665,Senators under strict orders to pay attention during weeks-long impeachment trial,0
666,Woman becomes a princess after marrying Ethiopian prince she met in nightclub,0
667,Man crushed to death by forklift truck driven by pet dog,0
668,White St. Louis police officer shoots off-duty black officer,0
669,"Only 'thoughts and prayers' will stop evil behind shootings, Florida state senator says",0
670,Woman 'secretly fattened up bridesmaids before wedding',0
671,Crystal Palace fans accidentally vandalise their own team bus,0
672,Japanese police arrest 74-year-old ninja thief suspect,0
673,Tulsa Officer Acquitted of Killing Unarmed Black Man Holds Police Shooting 'Survival' Class,0
674,Fans are legitimately upset that Michael Phelps didn't race a real shark,0
675,Free porn offered to quarantined coronavirus cruise passengers,0
676,Man tweets Harry Potter book line-by-line to Piers Morgan,0
677,Japanese zoo mourns anime-loving celebrity penguin,0
678,Ruth Bader Ginsburg to Make Cameo Appearance in 'Lego Movie 2',0
679,'Shock' as Vatican document says it is 'not essential' that consecrated virgins be actual virgins,0
680,Texas town holds .5K - not 5K - for underachievers,0
681,Chinese dating apps closed after women revealed to be robots,0
682,"Woman dies at 102, DirecTV charges early termination fee",0
683,Tillerson: 'I didn't want this job ... My wife told me I'm supposed to do this',0
684,Anger as Churchill's home is turned into Hitler HQ for Transformers 5,0
685,US Navy sailors instructed to 'clap like we're at a strip club' for Pence arrival,0
686,Thieves replace Paraguay police rifles with toy replicas,0
687,French serial-killer 'expert' admits he made up his experience — even the murder of his nonexistent wife,0
688,Man marks his ex-girlfriend's apology letter and sends it back to her,0
689,Second Spanish church falls prey to well-intentioned restorer,0
690,Rapper Soulja Boy Releases New Handheld Game Console and It Looks Terrible,0
691,Indian pilot returns home a hero and sparks mustache trend,0
692,Doctors save Canadian woman's life by removing her lungs for six days,0
693,"Exclusive: Neo-Nazi and National Front organiser quits movement, opens up about Jewish heritage, comes out as gay",0
694,Canada's immigration website crashes on election night,0
695,'I Don't Want to Go in a Police Car.' Body Camera Footage Captures Handcuffed 6-Year-Old's Tearful Pleas During Arrest at School,0
696,'Don't get shot by police' is goal of new advice in Arizona driver's manual,0
697,Sacha Baron Cohen’s ‘Who Is America?’ Deleted Scene May Have Exposed Elite Pedophile Sex Ring,0
698,The USMC would like you to know that being in armed combat is exactly like playing Super Smash Bros.,0
699,"Man searching for toilet stumbles across 49,000 year-old evidence of earliest human settlement in Australia",0
700,Man given $149 ticket for singing 90s dance song while driving,0
701,High Court to decide if police can enter your home and steal from you,0
702,Carjackers leave man's car behind after discovering it has a manual transmission,0
703,Finance boss stole £370k from his firm and bought kittens,0
704,"Cyclist celebrates stage win a lap early, goes on to finish 148th",0
705,"Bride cancels wedding, breaks up with fiancé after friends and family refuse to pay for $60G nuptials",0
706,Donald Trump Tweets SNL Is ‘Totally Biased’ After Sketch About His Twitter Habit,0
707,Arizona postal worker cooks steak on dashboard to show ‘unsafe’ working conditions,0
708,"'This Must Be Some Mistake,' Says Snowboarder After Winning Olympic Gold In Skiing",0
709,Child protection commissioner apologizes for saying ‘strong sperm’ could impregnate women in swimming pools,0
710,"Sam Elliott on his Oscar nod: ""It's about fucking time""",0
711,Alex Jones brags that he’s a “number one meme” during custody trial,0
712,Gold Coast police urging victims to drop complaints to improve crime statistics,0
713,Viral Chinese video game measures which players can clap fastest for President Xi Jinping,0
714,King of West African tribe returns to landscaping job in Canada,0
715,Theme park ride based on Princess Diana's fatal crash opens tomorrow,0
716,Bill would block computers bought in S.C. from accessing porn,0
717,David Attenborough Themed Raves Are Taking The UK By Storm,0
718,Dead or Alive Xtreme PC will downgrade boob physics on low-end hardware,0
719,Texas mom had to pay $600 to see video of 5-year-old daughter bullied on bus,0
720,People with serious food allergies want impostors to stop faking it in restaurants,0
721,"Chinese, Indian troops engage in 150-strong border brawl with fistfights and stone throwing, Delhi says",0
722,Eight-year-old wins $200 worth of cannabis products at youth hockey tournament,0
723,'I don't eat onion': FM Nirmala Sitharaman on skyrocketing onion prices,0
724,Qipao prom dress that caused a culture furore in the US draws head-scratching in China,0
725,Suicide Squad fans petition to shut down Rotten Tomatoes after negative reviews,0
726,U.S.-born panda twins struggle in China as they know only English,0
727,North Korea bans sarcasm because Kim Jong-un fears people only agree with him ‘ironically’,0
728,We regret to inform you that Rugrats now has a porn parody,0
729,Germany apologises after deleting Israel off the map,0
730,Pizza delivery man gets $180K settlement after being crushed by 400 pounds of cheese,0
731,Iceland witnesses record-breaking baby boom nine months on from humiliating England at Euro 2016,0
732,Gunman apparently stopped shooting to post online,0
733,Wisconsin DNR sold 10 hunting licenses to infants,0
734,"Payless Opens Fake Luxury Store, Sells Customers $20 Shoes For $600 In Experiment",0
735,"Ryanair asks wheelchair user to walk up stairs, leaves her crying at the gate",0
736,Missouri sues China for 'not doing enough' to stop coronavirus spread,0
737,"House Republicans claim an annual salary of $450,000 is middle class",0
738,Man facing car theft charges arrested after allegedly arriving at court in another stolen vehicle,0
739,Porn Site xHamster Wants to Produce ‘Sense8’ Season 3,0
740,Man crashes into tree after driving with his head out car window 'like Ace Ventura',0
741,British Airways system outage 'caused by IT worker accidentally switching off power supply’,0
742,"Woman with lupus took hydroxychloroquine for 19 years, still got COVID-19",0
743,ESPN: Browns want to interview former Secretary of State Condoleezza Rice for head coaching job,0
744,Paris Hilton thinks she would have been social figure like Princess Diana if it weren't for sex tape,0
745,UK believes Kremlin behind prank call to Foreign Secretary Boris Johnson,0
746,China Communist Party Kicks Out General Who Killed Himself,0
747,Police: Man angry he can't pump own gas in New Jersey punches worker,0
748,"Perth man says 'thanks' after thief leaves money, removes problem stereo",0
749,Officer gives firefighter apology cake: ‘Sorry I tased you’,0
750,"Exorcisms booming as Christian faith declines and internet offers easy access to black magic, priests told",0
751,"More condoms, fewer cigarettes found in annual New Jersey beach cleanup",0
752,Health Canada Warning Reminds Public Not to Eat Laundry Pods,0
753,Biden jokingly calls voter a 'lying dog-faced pony soldier' at New Hampshire event,0
754,Bike manufacturer sees huge reduction in delivery damage by printing TV on the box,0
755,"Trump puts Bannon on security council, dropping joint chiefs",0
756,TSA to deploy more floppy-ear dogs because they're less scary than pointy-ear dogs,0
757,"Milledgeville woman orders 'Moana'-themed cake, gets marijuana design by mistake",0
758,Statue's face 'too friendly for Satan',0
759,"Agencies advise on possible 'Lizard Man,' 'Bigfoot' sightings in South Carolina during eclipse",0
760,New Warriors: Marvel's First Non-Binary Hero is Codenamed Snowflake,0
761,One-Thousand-Year-Old Mill Resumes Production to Supply Flour Amid Pandemic,0
762,"Billionaires Taking Months-Long, Multi-Million Dollar Sabbaticals to Get 'Back to Basics'",0
763,Half of Detroit’s 8 mayoral candidates are felons,0
764,Write-in votes for Nick Saban may have swayed Alabama Senate,0
765,California Lawmaker Nicknamed 'Huggy Bear' Told to Stop Hugging People,0
766,Derailed train car hits bar named 'DeRailed' in Iowa,0
767,Walmart is being sued for inventing a fake craft brewery,0
768,School tells sixth-graders they can't say no when asked to dance,0
769,Delaware boy who defied mom to stay up and watch Netflix saves her from late-night fire,0
770,"Judge can’t end a trial just because he has ‘heard enough,’ appeal court rules",0
771,Comcast complains it will make less money under Calif. net neutrality law,0
772,Man accused of trying to pay prostitute with hamburger caught in police sting,0
773,U.S. government ordered to solve 'Case of the Incredible Shrinking Airline Seat',0
774,DOJ investigates itself,0
775,'The Drug Whisperer': Drivers arrested while stone cold sober,0
776,K-pop stans flooded the #WhiteLivesMatter hashtag on Twitter and Instagram with fancams and memes to drown out racist posts,0
777,Man's car gets stolen while he's busy robbing a store,0
778,Pro-Putin rapper sets record for unpopularity on Russian YouTube,0
779,Coronavirus Florida: Bradenton ‘church’ ordered to stop selling bleach as COVID-19 miracle cure,0
780,"Parking Meters Across NYC Not Accepting Credit Cards, Were Never Programmed To Work In 2020",0
781,Chicago goes nearly one week without a fatal shooting,0
782,New Yorkers repeatedly ticketed — even though they don’t have a car,0
783,"Fall Out Boy is sued for overuse of llama puppets in videos, marketing",0
784,Astronaut accused of hacking former spouse's bank account from space,0
785,Baltimore Mayor Jack Young Suggests Public Boxing Rings To End Street Beefs,0
786,Man 'pulled bag of cocaine from penis' after arrest for laughing at cops,0
787,"Madison Police: Car thieves leave car behind, do not know stick shift",0
788,Researchers suggest replacing car honks with duck quacks,0
789,2 clients of spa that offered 'vampire facials' diagnosed with HIV,0
790,Deputies: Pinellas Park man Googled 'how to rob a bank' then robbed a bank,0
791,"After 5 Days, Man in Gorilla Suit Almost Done Crawling the London Marathon",0
792,Arizona man selling ranch for $5M due to constant ‘alien attacks’,0
793,Lego admits it made too many bricks,0
794,Limerick student tricks scammer to give him money,0
795,Chinese restaurant offers bra-size discounts,0
796,"Robot being trained to shoot guns is ‘not a terminator’, insists Russian deputy prime minister",0
797,Child taken to hospital with constipation 'because school's strict loo roll policy left her too scared to go to the toilet',0
798,"London: Firefighter tries rescuing a Macaw parrot stuck in a roof, is asked to 'F*ck off' by the bird",0
799,"Microsoft pulls plug after chat robot slings slurs, rips Obama and denies Holocaust",0
800,"Queen's patronage has single-handedly saved the British hat industry, Philip Treacy says",0
801,Rocket City Trash Pandas chosen as new Madison baseball team’s name,0
802,Donkey leads escaped herd of goats and sheep through California neighborhood,0
803,Russian Journalist Charged for ‘Controlling Minds’ With ‘1984’ Reference,0
804,Crew called to own station: Response time 'exceptional’,0
805,Report: Some patients treated for putting sunblock in their eyes during eclipse,0
806,"Broadcom sues Netflix for its success: You’re stopping us making a fortune from set-top boxes, moans chip designer",0
807,The Teen Who Ashton Kutcher Hit With a Car Is Fine and Says It Turned Out to Be a 'Really Cool Experience',0
808,"Harvey Weinstein ""Desperately Trying"" to Hire Female Attorney at a Discount",0
809,"Bears In Ukraine Aren't Hibernating Because It's Too Warm, Have Started Suffering From 'Insomnia'",0
810,"W.Va. lawmakers try to give teachers smaller raise, accidentally pass bill giving them full raise",0
811,Report of Tiger Running Amok in Manhattan Turns Out to Be Raccoon: NYPD,0
812,The totally wireless AirPods have their first accessory: a wire,0
813,"Naked Russian Man Tries to Board Plane, Claiming to Be More 'Aerodynamic'",0
814,Italy's Sara Errani suspended for just two months after blaming mum's tortellini for failed drugs test,0
815,White House on banning CNN reporter from event: 'We support a free press',0
816,Former Norway PM held at Washington airport over 2014 visit to Iran,0
817,American Apparel founder Dov Charney: ‘Sleeping with people you work with is unavoidable’,0
818,Artist building wall of cheese at Mexico border to “Make America Grate Again”,0
819,Dad Accused of Raping Daughter Saved by Mention of 'Fifty Shades of Grey',0
820,"TPD says man stole car from jail parking lot, moments after being released from same jail",0
821,2 teen girls shot as Birmingham water balloon fight turns into gun fight at Senior Skip Day,0
822,"Cops get called for a noise complaint, find people playing Smash Bros. Ultimate, and join in on the fun",0
823,Proposed Bill Would Ban Cellphone Use For Anyone Under 21,0
824,DOT reminds drivers deer can't read signs,0
825,A 2nd Olympic pool has turned green,0
826,"Starbucks coffee in California must have cancer warning, judge says",0
827,"Today is the 8 year anniversary of the Stop Trading on Congressional Knowledge (STOCK) Act. The law prohibits the use of non-public information for private profit, including insider trading by members of Congress.",0
828,'Cancer patient' finds lump was toy traffic cone inhaled in 1977,0
829,Crocodile eats beloved terrier that had spent a decade taunting it,0
830,Toddler Dies after Anti-Vaxx Parents Treat His Meningitis with Maple Syrup Instead of Medicine,0
831,8 families find out they have been paying respects to the wrong graves for 39 years,0
832,"'We thought it was a prank': Girl, 6, finds China prisoner plea in Tesco charity card",0
833,Toronto man says Canada Post just delivered package he ordered 8 years ago,0
834,"Steve Harvey's new show Funderdome gets leaked, no-one downloads it",0
835,Baltimore Police officer mistakenly records himself with body cam planting drugs at crime scene,0
836,Man wearing TV on head caught on camera leaving old TVs on Virginia front porches,0
837,"Charlotte spent millions on low-income housing, but poor people can’t afford it",0
838,Teenager afraid of water and who couldn't swim died after jumping into canal to overcome fears,0
839,Missing hiker faces huge bill for rescue operation after he was found in luxury hotel,0
840,"Nurse calls out sick with flu, then gets fired for violating hospital’s attendance policy",0
841,"U.S. threatened Ecuador over support for resolution encouraging breastfeeding, report says",0
842,GOP chairman: Kids are ‘brainwashed’ on climate change,0
843,'Safer than London!' North Korea opens door to Russian tourists,0
844,"Saudi man arrested for flying ‘pretty’ rainbow flag, had no idea it represented gay pride",0
845,Juror Walks Off to Take Phone Call as Texas Tests First Jury Trial Via Zoom,0
846,"Cops used 'Big Blue' dildo to harass men and women, so town says lawsuit should be tossed",0
847,Guy Fawkes event in King's Point shut down for being actual dumpster fire,0
848,Miley Cyrus 'felt sexualised' while twerking during 2013 MTV VMA performance,0
849,California skate park filled with sand to enforce social distancing backfires as dirt bikers show up,0
850,Junk food cravings are triggered by the mere thought of being low class,0
851,"Oysters Can Get Herpes, And It’s Killing Them",0
852,City finally fixing sinkhole after fed-up residents grew tomatoes in it,0
853,England's oldest man says the secret to a long life is 'avoid dying' - and he has more to say,0
854,North Korean cheerleaders caught off guard by fake Kim Jong Un,0
855,Samuel L. Jackson endorses Rashida Tlaib's use of 'mother****er',0
856,Woman mistakes town meeting for Donald Trump rally and smears 30 cars with smooth peanut butter in protest,0
857,"Japan has a worrying number of virgins, government finds",0
858,Man Busted With 800 Pounds of Stolen Lemons,0
859,Dating website to match Canadians with Americans escaping Trump presidency,0
860,"Homeopathy 'treatments' must be labelled to say they do not work, US government orders",0
861,"Woman falsely reported that her husband killed her, police say",0
862,Kenyan vice president candidate debates himself after rivals' no-show,0
863,"Unaware of $2 bail, man spends almost five months in prison",0
864,Nigerians boycott Coca-Cola drinks after court rules them 'poisonous',0
865,Gianforte calls for civil politics after assaulting reporter,0
866,Former 'Top Gear' host Jeremy Clarkson says 'idiot' climate activist Greta Thunberg has killed the car show,0
867,New Zealand man challenges environment minister to a fist fight over water pollution policy,0
868,"Donald Trump too hard to satirise, say South Park creators Trey Parker and Matt Stone",0
869,Barnes & Noble’s Top 20 holiday gift ideas include only 1 book,0
870,Hamilton police ask public to ‘romaine calm’ after $45K lettuce heist,0
871,A British company will sell knives with square tips after a sharp rise in knife crime,0
872,China bans 'erotic' banana-eating live streams,0
873,Lawmaker pushing for less regulation has child die at his facility,0
874,"Saudi ad censors woman, replaces her with inflatable ball",0
875,Man In Drunk Lives Matter Shirt Charged With Drunken Driving,0
876,Dark web criminals 'offering Black Friday deals and discount codes',0
877,UAE's gender equality awards won entirely by men,0
878,Ottawa archbishop surprised by negative reaction to robotic spider on cathedral,0
879,Waldo man who threw party for pothole celebrates after it is fixed,0
880,Stephen Fry's blasphemy probe dropped after Irish police fail to find 'enough outraged people',0
881,Virginia used to have an official groundhog; it killed itself on Groundhog Day,0
882,Deputies ask man to quit calling about his stolen marijuana,0
883,"Why one Republican voted to kill privacy rules: ""Nobody has to use the Internet""",0
884,Suspect allegedly shot man with shotgun shell filled with cereal,0
885,Man cling-filmed car because he's sick of people parking outside his house and going on holiday,0
886,"Loud orgies of Mexican fish could deafen dolphins, say scientists",0
887,"Bishop says that given the abortion rate, it's hypocritical to mourn Cypriot serial killer's child victims",0
888,"Distracted Boyfriend meme is sexist, rules Swedish ad watchdog",0
889,"IRS awards Equifax no-bid, $7.25 million contract after hack",0
890,"Acting AG Matt Whitaker under fire for alleged Bigfoot, toilet, time travel scams",0
891,Wannabe Weatherman Arrested for Starting Wildfire to Get Facebook Views,0
892,Glasgow gym set to introduce fitness class consisting of nothing but SLEEPING for 45 minutes,0
893,John Oliver Bought Russell Crowe's Jockstrap for Alaska's Last Blockbuster Video,0
894,NBA will consider shortening games due to millennial attention spans,0
895,Sean Spicer’s tragic fall from grace as White House Easter Bunny,0
896,"Parents outraged after 5th graders pick cotton, sing songs on field trip",0
897,Steve Bannon registered to vote in two states despite Trump's cries of 'voter fraud',0
898,"Biden calls Iowa voter who pushed him on Ukraine 'a damn liar,' challenges him to pushup contest",0
899,"Ferry McFerryface unmasked: FOI reveals minister chose name, not the public",0
900,Death of the funeral? US state poised to legalise human composting amid demand for sustainable services,0
901,Nuclear submarine plans found in Welsh charity shop,0
902,‘Wolf of Wall Street’ Producer Riza Aziz Arrested on Money Laundering Charges,0
903,Boy gets six points on future driving licence for scooter speeding,0
904,Mexico politician mocked for campaign hashtag '#campaignhashtag',0
905,Wheelchair tennis event moved after court built on a slope,0
906,Man impersonating officer busted for attempting to pull over unmarked cruiser,0
907,"Utah lawmakers nix comprehensive sex ed, so porn site steps in",0
908,Ruth Bader Ginsburg ranks the best cities to buy scrunchies,0
909,"Pope to Catholics: For Lent, give up trolling",0
910,Blood of Poor Americans Now Comprises 2% of Total US Exports,0
911,Morgan Freeman Is Finally a GPS Navigation Voice,0
912,Restaurant to seat mannequins at empty tables to make social distancing less awkward,0
