,post_Title,onion
0,Protests about police brutality are met with wave of police brutality across US,0
1,"Don't eat or inject yourself with disinfectant, warns FDA commissioner",0
2,Louisiana eye doctor offers free eye exams for NFL referees after Saints loss,0
3,"Coronavirus homeschooling: 77 percent of parents agree teachers should be paid more after teaching own kids, study says",0
4,Man rescued from Taliban didn't believe Donald Trump was President,0
5,"Nat Geo hires Jeff Goldblum to walk around, being professionally fascinated by things",0
6,Black security guard who stops shooter is then shot and killed by police,0
7,"Hulu to 'Parasite' haters: 'If you don't want to read subtitles,' learn Korean",0
8,Experts Say George Floyd's Death Once Again Shows Police Officers Should Be Banned From Crushing People’s Necks,0
9,"People no longer believe working hard will lead to a better life, survey shows",0
10,Hunter dies after shot elephant falls on him,0
11,"'If You Say You Can’t Breathe, You’re Breathing’: Mississippi Mayor Defends Officers Involved in George Floyd’s Arrest",0
12,Mike Pence Once Ratted Out His Fraternity Brothers For Having a Keg,0
13,"Reddit CEO tells user, “we are not the thought police,” then suspends that user",0
14,"R.I.P. astronaut John Young, the first man to get yelled at for smuggling a sandwich into space",0
15,Trump dedicates golf trophy to hurricane victims,0
16,GameStop rules itself 'essential retail' and therefore immune to lockdown closures,0
17,"Hipster whines at tech mag for using his pic to imply hipsters look the same, discovers pic was of an entirely different hipster",0
18,President Trump: I would have run into school during shooting ‘even if I didn’t have a weapon’,0
19,"Baby boomers are more sensitive than millennials, according to the largest-ever study on narcissism",0
20,35 Y.O CEO Slams Other Millennials For Entitlement Despite Being Handed CEO Job By His Dad,0
21,Ben Affleck finally achieves lifelong dream of not having to play Batman anymore,0
22,‘Black Mirror’ Creator Says the World Is Too Bleak Right Now for Season 6 to Happen,0
23,Third Russian Doctor Falls From Hospital Window After Coronavirus Complaint,0
24,"Man who ate $120,000 art banana said he would've done it sooner, but wasn't hungry yet",0
25,Stimulus Checks May Be Delayed As Trump Requires U.S. Treasury to Print His Name on Them,0
26,"EA: They’re not loot boxes, they’re “surprise mechanics,” and they’re “quite ethical”",0
27,Blind man fails citizenship test after being denied Braille,0
28,"North Korean Founder Kim Il Sung Did Not Have the Ability to Teleport, State Media Admits",0
29,ICE Director: ICE Can't Be Compared To Nazis Since We're Just Following Orders,0
30,Uber’s search for a female CEO has been narrowed down to 3 men,0
31,"Dogs cannot get ‘autism’, British Veterinary Association warns after ‘anti-vaxx’ movement spread to pets",0
32,Somali Militant Group Al-Shabaab Announces Ban On Single-Use Plastic Bags,0
33,United Nations official visiting Alabama to investigate 'great poverty and inequality',0
34,Man arrested for smoking marijuana while in court for marijuana charge,0
35,"Woman Named Marijuana Pepsi, Who Refused To Change Her Name, Earns Her Ph.D After Completing Dissertation On Black Names",0
36,Florida House declares porn a public health risk shortly after denying assault rifle ban,0
37,Passenger turned away from two flights after wearing 10 layers of clothing to avoid luggage fee,0
38,Congress To Make Members Pay Out Of Pocket For Sexual Harassment Settlements,0
39,25% of Wyoming stay at home workers are drinking during working hours,0
40,A YouTuber got the inflammatory right-wing commentator Katie Hopkins to fly to Prague to pick up a fake award whose initials spelled out the C-word,0
41,Fox News Stars Now Pretend They Never Said What They Said About the Coronavirus,0
42,Sean Spicer says Oprah Winfrey Doesn’t Have the Political Experience to be President,0
43,White House press secretary attacks media for accurately reporting inauguration crowds,0
44,"UPS loses Family’s $846K Inheritance, Offers to Refund $32 Shipping Fee",0
45,School boy takes MICROWAVE to school to carry books after school bans bags,0
46,"A zoo has been trying to get two pandas to mate for 10 years. When coronavirus shut the zoo down, the pandas finally did",0
47,Alabama lawmaker: We shouldn't arm teachers because most are women,0
48,"Marilyn Manson Mourned On Twitter, Confusing Him For Dead Mass Murderer Charles",0
49,"Gay man's pay slashed so he'd be on par with 'other females in the office,' lawsuit claims",0
50,Trump calls Warren 'Pocahontas' at event honoring Native American veterans,0
51,Cat named after Notorious B.I.G. shot multiple times — and survives,0
52,"No, this isn't The Onion, Yes Net Neutrality is under attack and we have less than a month to save it. Fight to save Net Neutrality today!",0
53,Saudi Arabia declares online satire punishable offence,0
54,"Catholic priest says ""pedophilia doesn't kill anyone"" after barring pro-abortion lawmakers from communion",0
55,"Trump Says Energy-Efficient Light Bulbs Make Him 'Look Orange,' Complains About How Expensive They Are",0
56,"Chile Counts Those Who Died of Coronavirus as Recovered Because They're 'No Longer Contagious,' Health Minister Says",0
57,"Portland strip club forced to close, so dancers now do delivery",0
58,American parents say their children are speaking in British accent after watching too much Peppa Pig,0
59,EPA Head Says He Needs to Fly First Class Because People Are Mean to Him in Coach,0
60,Cards Against Humanity buys plot of land on U.S./Mexico border to block border wall,0
61,Five guys arrested after fist fight at Five Guys,0
62,Apology after Japanese train departs 20 seconds early,0
63,Justin Bieber banned from China in order to 'purify' nation,0
64,Alcohol level in air at fraternity party registers on Breathalyzer,0
65,Alberta minister says it’s a ‘great time’ to build a pipeline because COVID-19 restrictions limit protests against them,0
66,"Always look on the bright side of life, says CEO who raised EpiPen price by more than 400%",0
67,Trump calls Dems who didn't clap during State of the Union 'treasonous' and 'un-American',0
68,Coronavirus: Pastor who decried 'hysteria' dies after attending Mardi Gras,0
69,"NPR tweets the Declaration of Independence, and people freak out about a ‘revolution’",0
70,McDonald's worker fired for refusing to serve paramedics: 'We don't serve your kind here',0
71,"Detroit man settles race discrimination lawsuit, then bank won't cash his check",0
72,"Missouri man must watch ‘Bambi’ monthly as part of poaching punishment, judge rules",0
73,"Melania flew to Texas to visit immigrant children wearing a jacket that says 'I really don't care, do u?'",0
74,Man who mowed lawn with tornado behind him says he 'was keeping an eye on it.',0
75,Michael B. Jordan buys teen a new retainer after she bit through it during his shirtless Black Panther scene,0
76,Ferry McFerryface to be name of new Sydney ferry after public vote,0
77,British politician wants death penalty for suicide bombers,0
78,Missouri Republican Who Said ‘Hitler Was Right’ Wins State House Primary,0
79,Texas Students Will Soon Learn Slavery Played a Central Role in the Civil War,0
80,US Republicans endorse arming toddlers on Sacha Baron Cohen show,0
81,"A man harasses a woman for wearing a Puerto Rico shirt, saying it's 'un-American'",0
82,Michael Cohen paid IT firm to tweet that he was sexy,0
83,"CVS rejects Purdue student's Puerto Rican ID, asks for immigration papers to buy cold medicine",0
84,A mayor ordered police to crack down on social gatherings. They found his wife at a bar,0
85,"""It's Not Like We Have a Massive Recession or Worse,"" Says Trump After 10 Million Lost Their Jobs in Two Weeks",0
86,The number of Delta Air Lines passengers who bought tickets with NRA discount: 13,0
87,Alt-Right White Supremacists Claim Papa John's as Official Pizza,0
88,White supremacists taking DNA tests sad to discover they’re not 100% white,0
89,Abortion Clinic Protestors Cited for Violating Order Prohibiting Large Gatherings,0
90,Crowd torches man's car after he pointed bow and arrow at Utah protesters,0
91,"Army veteran has prosthetic legs repossessed after VA refuses to pay for them: ""Medicare did not send me to Vietnam""",0
92,"After eating Chipotle for 500 days, an Ohio man says he's ready for something new",0
93,Weatherman Jamie Simpson Tells Viewers to Stop Complaining About Tornado Warnings Interrupting 'The Bachelorette': 'This Is Pathetic',0
94,"Yes, New York liquor stores are deemed essential businesses",0
95,Supreme Court rules Georgia can’t put the law behind a paywall,0
96,School turns students' lunch debt over to collection agency,0
97,‘El Chapo’ promises not to kill any jurors from upcoming federal trial,0
98,Poll: Kim Jong Un has higher approval among Republicans than Pelosi,0
99,"After 4th DWI, man argues legal limit discriminates against alcoholics",0
100,"Since Jay-Z put out an album called 4:44, Jersey prog band 4:44 put out an album called Jay-Z",0
101,Palestinian judge bans divorce during Ramadan because ‘people make hasty decisions when they’re hungry’,0
102,‘We want you back’ - Boris Johnson urges EU workers to return to UK to help the economy,0
103,"Cops take seized SUV for joyride; owner tracks car, locks them inside for 3 hrs",0
104,Queen cancels Prince Andrew's 60th birthday party,0
105,Argentinian officers fired after claiming mice ate half a ton of missing marijuana,0
106,Detective Pikachu cinematographer happy his CGI monstrosities less obviously awful than Sonic's,0
107,"Harambe: Stop making memes of our dead gorilla, Cincinnati Zoo pleads",0
108,"Jeff Sessions: Marijuana Is ""Only Slightly Less Awful"" Than Heroin",0
109,DC bars to open early for Comey hearing watch parties,0
110,Maryland governor says coronavirus tests acquired from South Korea under guard at undisclosed location to protect the tests from seizure by the federal government,0
111,Florida Mayor Arrested Just Weeks After Taking Over for Florida Mayor Who was Arrested,0
112,Man killed by blade-wielding rooster during illegal cockfight,0
113,Former Barney the Dinosaur actor now works as a controversial tantric sex guru,0
114,Massive cow named Knickers has been deemed too large to eat,0
115,Trump gets a folder full of positive news about himself twice a day,0
116,“An almond doesn’t lactate:” FDA to crack down on use of the word “milk”,0
117,NYPD Union Sues To Stop Release Of All Bodycam Footage Because It Violates Officers’ Civil Rights,0
118,EU warns Turkey after it violates Greek airspace 141 times in one day,0
119,Group of teen girls tries to set trap for alleged pedophile; one ends up kidnapped,0
120,Tiananmen Square Massacre: China Says U.S. Is Violating International Law By Honoring 30th Anniversary,0
121,"Texas prisons deny dentures to inmates with no teeth, claim chewing 'isn't a medical necessity'",0
122,The man who stole a plane said he didn't need much help: 'I've played some video games',0
123,Report: Man caught camping on Disney’s Discovery Island says it was ‘tropical paradise',0
124,"University professor compares 'OK, boomer' to 'n-word,' students say",0
125,Joe Biden claims to have worked on 2016 Paris climate deal with Chinese leader who died in 1997,0
126,"White House blocks CNN, BBC, New York Times, LA Times from media briefing",0
127,'Nobody kill anybody': Murder-free weekend urged in Baltimore,0
128,Tobacco company Philip Morris starts life insurance firm that offers discounts to smokers who quit,0
129,Michigan is considering move to ban guns inside state Capitol Building,0
130,Stephen King Is Sorry You Feel Like You're Stuck In A Stephen King Novel,0
131,Teacher Of The Year In Oklahoma Moves To Texas For The Money,0
132,Macaulay Culkin to legally change his middle name to Macaulay Culkin,0
133,Navy pilots request to be armed because they don't trust overweight police at military bases,0
134,Pakistani girl who died in Texas shooting ‘wanted to experience American culture’,0
135,"Family forced to sit on plane floor after airline allocated them seats which didn't exist, it emerges",0
136,Michelin Star Restaurant Owner Invited Clemson Tigers To Experience 'What An Actual Celebration Dinner Should Be',0
137,"After 140 mph chase, man tells police he didn’t think their cruisers could catch his 2002 Acura",0
138,'I don’t understand how you can be a pedophile and keep your job’: 12-year old asks NHC School Board,0
139,Suspected murderer who evaded capture for 12 years by pretending to be mute loses voice from underuse,0
140,Bill Cosby Gets Vanilla Pudding in Jail for First Meal Behind Bars,0
141,Thousands unfollow Sen. John McCain after he asks for more Twitter followers,0
142,Iceland's president admits he went 'too far' with threat to ban pineapple pizza,0
143,"Texas judge interrupts jury, says God told him defendant is not guilty",0
144,Detroit's largest demolition contractor demolishes the wrong home — again,0
145,Speeding Arizona Congressman Claims 'Immunity' When Pulled Over; Brags to Cop He Goes Even Faster,0
146,The creators of the Nintendo 64 GoldenEye have officially ruled: Oddjob is cheating,0
147,Fox News isn’t worried about millions losing insurance since “we’re all going to die”,0
148,Bush says Trump ‘makes me look pretty good’ by comparison: report,0
149,NRA Says New Florida Law Would Take Away Rifles From '10-Year-Old Little Girls' on Their Birthdays,0
150,"TX Woman Dies Of COVID After Posting Facebook Rant: “You Don’t Need Sanitizer, You Need Faith And Guns”",0
151,"Merriam-Webster adds ""sheeple"" to dictionary, cites Apple users as an example",0
152,Americans are driving less because of the coronavirus. That's hurting red-light camera revenue.,0
153,'We want sauce': police called after McDonald's Rick and Morty promotion heats up,0
154,R. Kelly's lawyer is complaining that the singer can visit with only one of his girlfriends at a time,0
155,‘They can't stop all of us': More than 250K pledge to storm Area 51 to uncover alien secrets,0
156,Man Found Dead In Wife’s Freezer After A Decade Left Note Saying She Didn’t Kill Him,0
157,France Is Running Out of Butter for Its Croissants,0
158,Metalheads with kazoos drown out Westboro Baptist Church at Virginia Capitol.,0
159,Utah teacher fired after showing students classical paintings which contained nudity,0
160,First Lady Melania Trump Says She Is 'the Most Bullied Person in the World',0
161,Mexicans wonder if Trump's wall could stop coronavirus spreading south,0
162,American man was arrested for scamming Nigerians of over N150 million,0
163,Police: Naked Man Arrested At Planet Fitness Cites ‘Judgment Free Zone’,0
164,Ohio State fan in coma asked if he likes Michigan responds 'No',0
165,Armed black citizens escort Michigan lawmaker to capitol after volatile rightwing protest,0
166,Saudi Arabia accidentally prints textbook showing Yoda sitting next to the king,0
167,"“Japan’s slowest roller coaster” derails, passengers don’t notice",0
168,"'Even Hitler didn't sink to using chemical weapons', says Spicer of Syria attack",0
169,"Texas woman arrested for marijuana takes mugshot, gets requests for makeup tips",0
170,Avocado crime soars as Mexican gangs turn focus from opium to ‘green gold’,0
171,Drunk tourist accidentally climbs mountain while trying to get back to his hotel,0
172,Medical Fetish Site Donates Entire Stock of Scrubs After Being Contacted by 'Desperate' Health Officials,0
173,Instagram Influencer With 2.6m Followers Struggles To Sell 36 T-Shirts,0
174,Moray rapist who tried to cheat justice by claiming he was too fat to appear in court died of heart disease,0
175,‘Drunk’ tourist thought to be the first person to survive swim across Hoover Dam,0
176,Judge orders Alabama not to destroy voting records in Tuesday's Senate election,0
177,"In final-hour order, court rules that Alabama can destroy digital voting records after all",0
178,"YouTube will soon tell you that the world isn't flat, vaccines work, and other obvious truths",0
179,"Please Don't Roast Marshmallows Over the Erupting Hawaii Volcano, USGS Warns",0
180,"Families earning $117,000 now qualify as ""low income"" in California's Bay Area",0
181,Minecraft hosts uncensored library full of banned journalism,0
182,Fox Business Host Calls Former President George W. Bush a 'Radical' Liberal,0
183,Trump claims army 'took over airports' in 1775,0
184,Kellyanne Conway suggests Barack Obama was spying on Donald Trump through a microwave,0
185,Thousands sign petition asking for fines against people who call 911 to complain about Amber Alerts,0
186,Sex outside of marriage may soon be legal in Utah,0
187,Jill Stein raised more money for her recount effort than she did during the election,0
188,TSA agents are apparently still confused as to whether the District of Columbia is in the U.S.,0
189,Christian family who argued taxes 'against God's will' ordered to pay $2.3m bill,0
190,US cop fired over deadly shooting 'rehired to get pension',0
191,U.S. warns of feral hogs approaching country from Canada,0
192,FBI director James Comey admits under oath that he hates the Patriots,0
193,"Robber returns money to Philly store, says it’s not enough for his kid’s transplant",0
194,Virginia GOP delegate tries to kill own bill to remove Democratic segregationist statue after Democrats support the bill,0
195,"Florida is the worst state in the nation in every way, new rankings say",0
196,'Mary Was a Teenager.' Alabama Republican Uses Jesus to Defend Roy Moore,0
197,Male cat needs glucose drip after mating with five females in one night in pet hotel,0
198,Hurricane victims call sex hotline after FEMA mistakenly tweets wrong number,0
199,The world's oldest living land creature is a gay tortoise named Jonathan,0
200,"Over 500 Canadian doctors protest raises, say they're being paid too much",0
201,‘Dr. Marijuana’ suspended for indiscriminately referring thousands of patients for medical weed,0
202,Woman gets lifetime bus pass for 103rd birthday,0
203,Family says supermarket wouldn't write Summa Cum Laude on a cake due to profanity,0
204,Women's cycling race forced to pause after lead rider catches men's race,0
205,"US lost track of 1,500 immigrant children, but says it's not 'legally responsible'",0
206,Texas lawmakers consider the death penalty for abortion,0
207,"Amish man launches ""Uber"" ride service with his horse and buggy",0
208,Candidate for Charlotte mayor puts 'white' among qualifications,0
209,Florida Drug-sniffing K-9 Called Jake Overdoses While Screening Passengers Boarding EDM Party Cruise Ship,0
210,Man finds car 20 years after forgetting where he parked it,0
211,"Keeping Up With The Kardashians may make viewers cold-hearted towards poor, study suggests",0
212,Quebec denies French citizen's immigration application because chapter of thesis was in English,0
213,2 kids dressed as 'tall man' unable to gain admission to 'Black Panther',0
214,Facebook is suggesting mobile users 'Protect' themselves...by downloading a Facebook-owned app that tracks their mobile usage,0
215,Sheriff who pocketed $750K from inmate food fund bought beach house for $740K,0
216,"'I was annoyed': Woman, 95, shoos black bear out of kitchen twice in one day",0
217,Ad stating alcohol is a drug blocked as ‘too political’,0
218,"Juncker used ‘brightly coloured, simple flashcards’ to explain trade to Trump during meeting",0
219,"Sign language interpreter used gibberish, warned of bears, monsters during Hurricane Irma update",0
220,"Woman tells TripAdvisor she was raped by guide, TripAdvisor tells her to leave bad review",0
221,Cop Does Not Shoot Unarmed Man,0
222,Man Creates Tinder-Like Dating App Where He’s the Only Guy Available,0
223,Ambien-maker to Roseanne: Racism is not a side effect of our drug,0
224,Alabama Won’t Air “Arthur” Cartoon With Gay Wedding,0
225,"Senate adopts resolution declaring ""the press is not the enemy of the people""",0
226,Man launches GoFundMe page to ‘protect Betty White from 2016’,0
227,Elderly Americans Are Dying Without Getting To Read Mueller's Report - And They're Not Happy About It,0
228,"Ex-Chipotle manager, accused of stealing $626, gets $8 million for wrongful termination",0
229,"Tom Holland’s Drunk, Crying Phone Call With Disney CEO Saved Spider-Man From MCU Exit",0
230,Seagulls keep couple hostage in their own home for six days by attacking them every time they leave house,0
231,Man checks in a can of beer as only luggage on Perth bound flight,0
232,"Cruise Ship Refunds Passengers After 1,300 Men Took Over and Turned It Into a Giant Burlesque Show",0
233,Donald Trump says he doesn't need daily intelligence briefings as President because he's 'smart',0
234,April Fools' is Cancelled Because We Can't Distance Fact From Fiction,0
235,World’s No 1 bridge player suspended after failing a drugs test,0
236,Harvey Weinstein's lawyer says she's never been sexually assaulted 'because I would never put myself in that position',0
237,Flight Attendant Orgy Denied By Airline Despite Being Caught On Camera,0
238,Six Flags cancels massive snowball fight due to ... real snow,0
239,Fire breaks out at Chinese factory that makes Samsung Note 7 batteries,0
240,President Donald J. Trump Proclaims April 2017 as National Sexual Assault Awareness and Prevention Month,0
241,"Pastor was ‘counseling’ the young, naked man tied up in his car, he says",0
242,Remorseful husband who robbed bank to escape wife sentenced to home confinement,0
243,Zach Braff Discovered He’s Being Used To Advertise Erection Pills In Ukraine,0
244,A pug has been hired by 343 industries to make alien sounds for Halo Infinite,0
245,Adult Film Star Ron Jeremy Fighting to Save Tree Outside His Childhood Home in Queens,0
246,"Yoga Does Not Make Inmates Gay, Says Russian Prison Chief As Classes Are Reinstated",0
247,House hearing on gun legislation canceled after shooting,0
248,"Google Says It Will Stop Android Phones From Suggesting ""My Face"" When Users Type ""Sit On""",0
249,"Conservative pastor says Jesus would have ""beat the crap"" out of John Bolton",0
250,Police: Connecticut Man Tests His New Guns By Firing Into Park Full Of Kids Playing Softball,0
251,Labrador: ‘Nobody dies because they don’t have access to health care’,0
252,"Dennis Prager Thinks It's 'idiotic That You Cannot Say The N-word,' Blames The 'disgusting' Left",0
253,"Trump says he may pardon Muhammad Ali, who does not need a pardon",0
254,Billionaire Howard Schultz is very upset you’re calling him a billionaire,0
255,"Air Canada flight turns back halfway to Hawaii, passengers get $10 vouchers",0
256,"The Pentagon promises to use artificial intelligence for good, not evil",0
257,Couple Couldn't Conceive Because They'd Been Having Sex the Wrong Way for Four Years,0
258,Biden said you have to 'keep punching' to address domestic violence,0
259,"Donald Trump 'feels great' about criticism of spending millions on Mar-a-Lago trips, says Sean Spicer",0
260,Dr. Fauci sexiest man alive gaining steam,0
261,Video game company urges players to avoid Plague Inc. game for information on coronavirus,0
262,"Losers are more likely to believe in conspiracy theories, study finds",0
263,The Room's Tommy Wiseau Wants to Make a Star Wars Movie,0
264,Texas couple considering divorce to help pay for daughter's health care costs,0
265,Japanese couple apologise for ignoring work pregnancy timetable by conceiving ‘before their turn’,0
266,People keep uploading Hamilton to PornHub,0
267,Man drives away from court minutes after judge prohibits him from driving,0
268,"Red Bull and vodka is scientifically proven to start fights, study says",0
269,"Student Hacked Into Downingtown Area School District System To Gain Competitive Advantage In Water Gun Fight, Officials Say",0
270,CEO Of Wall Street Bank That Took $25 Billion Bailout Warns Of Socialism For Everyone Else,0
271,Fox News's 'Swedish defence advisor' unknown to country's military officials,0
272,Burger King to give Bronx residents free Whoppers for dealing with 'Joker Stairs' tourists,0
273,Store closes after Nike boycott: 'More Colin Kaepernick fans than I realized',0
274,Putin points at journalists and asks Trump 'Are these the ones hurting you?' during press conference,0
275,Surgeon admits to branding initials on patients' livers,0
276,Roseanne Barr says Fergie's national anthem performance was worse than her 1990 rendition,0
277,2020 Tokyo Olympics: Athletes Assured Cardboard Beds Won't Collapse During Sex,0
278,Texas lt. governor on reopening state: 'There are more important things than living',0
279,Library asks people to stop paying fines with Chuck E. Cheese tokens,0
280,Cop uses mating call on his phone to lure back zoo's escaped peacock,0
281,"Pablo's Escoburgers restaurant draws backlash for name, serving hamburger with line of fake cocaine",0
282,CNN legal analyst Areva Martin accuses David Webb of ‘white privilege’ before learning he’s black,0
283,Joel Osteen Says He Didn't Open His Church for Shelter From Harvey Because Nobody Asked Him To,0
284,Hundreds of people gather to say ‘wow’ like Owen Wilson,0
285,City won't fix laneway because it's owned by a man who's been dead for 118 years,0
286,Baltimore restaurant owner can't get employees to return because they make more in unemployment,0
287,"Police Owe Nothing To Man Whose Home They Blew Up, Appeals Court Say",0
288,Lawyer sentenced to 18 years for smashing chair on judge's head,0
289,Man whose wife has cancer gets help to pay bills by winning $100K lottery prize,0
290,"Austrians can swear or make obscene gestures at politicans, court rules",0
291,YouTube cuts popular live stream of giraffe about to give birth for ‘nudity and sexual content’,0
